"Title","WorkoutType","WorkoutDescription","PlannedDuration","PlannedDistanceInMeters","WorkoutDay","CoachComments","DistanceInMeters","PowerAverage","PowerMax","Energy","AthleteComments","TimeTotalInHours","VelocityAverage","VelocityMax","CadenceAverage","CadenceMax","HeartRateAverage","HeartRateMax","TorqueAverage","TorqueMax","IF","TSS","HRZone1Minutes","HRZone2Minutes","HRZone3Minutes","HRZone4Minutes","HRZone5Minutes","HRZone6Minutes","HRZone7Minutes","HRZone8Minutes","HRZone9Minutes","HRZone10Minutes","PWRZone1Minutes","PWRZone2Minutes","PWRZone3Minutes","PWRZone4Minutes","PWRZone5Minutes","PWRZone6Minutes","PWRZone7Minutes","PWRZone8Minutes","PWRZone9Minutes","PWRZone10Minutes","Rpe","Feeling"
"The MACH 5 MONDAY ""CHECK-IN""","Other","The 5 in ""MACH 5"" refers to the five fundamental areas in life that affect athletic performance including training, health/rest, nutrition, balance, and mental/emotional. Please give me some details about the following 5 areas for today/last week: . 1) Training: how do you feel in general about your recent training and motivation? .Motivation pretty high. 2) Health/Restoration: How many hours of sleep have you been getting the last few nights and how is the quality of your sleep? 7-8 Are you stretching? Yes Do you have any sniffles/sore throat/cough/abnormal fatigue, etc? Nothing abnormal Do you have any problem areas, muscularly or otherwise? No . 3) Nutrition, how has your nutrition been the last few days? Poor over the weekend as I was celebrating What was your morning weight? .Not sure I want to look at it after a weekend with beer and pizza but last week I weighed 180 4) Life/Balance: How has your life-balance of work/school/family/play/stress/etc been this last week? Girlfriend is very aware of my dietary and sleep needs, and wants to go to South Africa as bad as I do. Friends understand for now lol . 5) Mental/Emotional: how ya feeling in general? Anything affecting your training or racing that I should be aware of? Emotionally very strong, focused on the upcoming races, and visualizing racing constantly","0.0833333333333333","","2019-04-01","","5394.509765625","","","","","1.27964806556702","1.1710000038147","","46","","94","122","","","0.562025720082974","45.03","77","0","0","0","0","","","","","","","","","","","","","","","","5","3"
"Banff vacation","Other","","","","2019-04-01","","","","","","","","","","","","","","","","","","","","","","","","","","","","","","","","","","","","","","",""
"Bike, Z1 Recovery","Bike","Easy bike in Active Recovery Zone. Very light effort on the pedals. Low heartrate and easy pace.","1","","2019-04-02","","0","217","441","981.105","","1.25661337375641","0","","87","","136","161","","","0.735211547779337","67.42","36","18","8","0","0","","","","","","28","16","12","14","2","0","","","","","",""
"~Easy Brick Run right off the bike","Run","Keep it easy and very comfortable, by feel.","0.5","","2019-04-02","","8495.650390625","","","","","0.668722212314606","3.52900004386902","","90","","147","166","","","0.950847514414278","66.29","5","18","7","0","0","","","","","","","","","","","","","","","","",""
"Z2 Swim, Four of Everything {2800}","Swim","2 x 500 warmup with 30 seconds rest 4x200 with 15 sec rest 4x125 (25 stoke/75 free) with 10 sec rest 4x100 Fast with 20 sec rest 4x50 easy swim with pull buoy, 15 sec rrest 4x25 Fast on 15 sec rest Cool down 200 easy","1","2560.32006835938","2019-04-02","","2926.08","","","","","0.779445003403558","1.04279326501651","","27","","","","","","0.873019257043674","51.86","","","","","","","","","","","","","","","","","","","","","5","3"
"Hip Stretching Routine","Other","Following these 8 exercises stretching the hips and core. Do not rush this. https://gmb.io/hip-mobility/ 1. Lying Hip Rotations 2. Piriformis Stretch 3. Butterfly 4. Frog 5. Kneeling Lunge 6. Traveling Butterfly 7. Squatting Internal Rotations 8. Pigeon","0.333333333333333","","2019-04-02","","","","","","","0.333333333333333","","","","","","","","","","","","","","","","","","","","","","","","","","","","","","","",""
"Run, Tempo Fartlek Ladder 120, 60, 30","Run","Warmup 10 minutes easy running. Run 4 sets of 2 minutes moderately hard 1 minute easy 1 minute hard 30 seconds easy 30 seconds very hard Take two minutes easy running between sets. Cool down 5 minutes easy.","1","","2019-04-03","","13036.08984375","","","","","1.04640078544617","3.46099996566772","","89","","146","167","","","0.933664025115621","101.16","9","22","12","0","0","","","","","","","","","","","","","","","","7","5"
"Swim, Mix it up Steady/Fast {4500}","Swim","Warm up 400 free, 200 backstroke, 100 breastroke - all easy pace, 10s RI 4x25 fly on 15s RI Kick Set, with fins, done twice Through: 200 steady on 10s RI 2x50 fast with board on 10s RI Pull Set, 3 times Through: 400 pull alt by 100 easy / steady - 20s RI 2x50 fast on 10s RI Transition with 200 easy swim with fins Main Set 3 x [4x100] Swim #1 and #2 free mod-hard on 10s RI Swim #3 is free easy pace, DPS on 15s RI Swim #4 - IM or 100 Build, your choice Take 30s RI between sets Cool Down with 200 easy mix of strokes","1.25","4114.7998046875","2019-04-03","","4114.80859375","","","","","1.16765417046017","0.978557905676899","","26","","","","","","0.749367279200983","49.14","","","","","","","","","","","","","","","","","","","","","4","3"
"Strength, back/core/upper body/TRX","Strength","Perform back, core, and upper body exercises. Examples include crunches, planks, push ups, bicep curls, tricep extensions, lat pulldowns, shoulder raises, etc. Do these at high rep, low weight. Circuit format is best. Can be TRX exercises","0.416666666666667","","2019-04-03","","","","","","","","","","","","","","","","","","","","","","","","","","","","","","","","","","","","","","",""
"Z2 Aerobic Bike with Big Gear efforts, 3 x 10 [zone 3]","Bike","Warmup 15 minutes easy. Ride in Zone 2 today, pushing to the upper half of Zone 2 if feeling good. A little riding in low zone 3 during the big gear efforts is okay, but don't force it. Include 3 x 10 minutes at ""big gear"" efforts in zone 3. Shift into a gear that puts your cadence approximately at 65-75 rpm. Focus on smooth, steady pedal strokes. Ride 5 minutes high cadence in between efforts in Z2 Cool down 10 min with high cadence zone 1 riding.","1.25","","2019-04-04","","0","227","346","1025.177","","1.25168609619141","0","","83","","135","158","","","0.75893829565763","71.67","40","26","2","0","0","","","","","","16","19","13","20","0","0","","","","","5","3"
"~Easy Brick Run right off the bike","Run","Keep it easy and very comfortable, by feel.","0.416666666666667","","2019-04-04","","5123.43017578125","","","","","0.429355829954147","3.31500005722046","","88","","137","150","","","0.884631322652145","36.4","16","1","0","0","0","","","","","","","","","","","","","","","","",""
"Swim, Recovery 4 x 300, 4 x 200 {3100}","Swim","Warmup 400 freestyle, 100 choice, 100 pull Swim 4 X 300 easy, with up to 1 minute rest in-between. 4 x 200 done as 50 free/50 free drill/50 free/50 stroke. 15 sec RI Pull 3 X 100 with buoy. Cool down easy 200 easy choice.","0.833333333333333","2834.63989257813","2019-04-04","","2834.642578125","","","","","0.796763893233405","0.988020467716761","","26","","","","","","0.756533186360199","34.5","","","","","","","","","","","","","","","","","","","","","",""
"Supplemental Strength C (2 rounds)","Strength","Do two sets of 15 repetitions of each exercise, using approximately 60 percent of your one-repetition maximum resistance. Concentrate on maintaining good form and on taking a full two seconds on the concentric movement (lifting the weight) and four seconds on the eccentric movement (lowering the weight). Rest 30 to 60 seconds between sets. Squat Lat pulldown Leg extension Bench Press Leg curl (hamstrings) Biceps curl Triceps exercise (choice) Seated row Abdominals (curl-up, reverse & oblique curl, crunch) Side/lateral shoulder raise","0.833333333333333","","2019-04-05","","","","",""," *04/06/2019 Keith Kruelskie: Lifting is hard!*","0.833333333333333","","","","","","","","","","","","","","","","","","","","","","","","","","","","","","","7","5"
"Z1 Easy Run before/after Strength Routine","Run","Easy run done before or after strength session. All Zone 1.","0.416666666666667","","2019-04-05","","5190.4599609375","","","","","0.42794805765152","3.36899995803833","","90","","148","166","","","0.921445983187552","39.42","1","12","5","0","0","","","","","","","","","","","","","","","","",""
"Swim, 200 builds {3000}","Swim","Warmup 400 Swim 100 Kick 6 x 50 done as 25 stroke/choice, 25 free Main Set 400 neg split, 20 sec RI 4 x 100 pace (75%) @ 10 sec 6 x 200 swim @ 15 sec rest odds build from 80-95%, evens are easy 100 kick with board 100 easy Cooldown","1","2743.19995117188","2019-04-05","","2743.2021484375","","","","","0.781643614768982","0.974482430391629","","26","","","","","","0.746291250970254","32.49","","","","","","","","","","","","","","","","","","","","","",""
"Z2 Bike, Aerobic Ride","Bike","Warmup up 10 minutes light spinning. Ride in Aerobic Zone 2. Progress from low to high Zone 2 throughout the workout. Throw in a 15 second pickup every 15 minutes. Cool down 10 minutes easy. Cadence range is 80-105 rpm, with cadence mostly in the 90s. Log average HR in the Post-Activity Comments.","4.5","","2019-04-06","","105668.3671875","229","483","2498.541"," *04/06/2019 Keith Kruelskie: Finishing indoors due to weather*","3.03592348098755","9.66800022125244","","90","","142","157","","","0.732436728273209","162.24","54","53","0","0","0","","","","","","17","78","45","11","4","0","","","","","5","3"
"Z2 Brick Run","Run","Transition from biking to running asap. Keep run in Aerobic Zone 2. Keep cadence quick. Walk 5-10 minutes easy for cool-down.","0.75","","2019-04-06","","9257.669921875","","","","","0.764724731445313","3.36299991607666","","88","","147","162","","","0.902344366763128","68.49","6","21","8","0","0","","","","","","","","","","","","","","","","6","3"
"Practice your exact race day nutrition protocol","Other","Write down below exactly what you ate and drank on today's session. Total the calories during the training session as well as the total mg of sodium.","","","2019-04-06","","","","","","","","","","","","","","","","","","","","","","","","","","","","","","","","","","","","","","",""
"Hip Stretching Routine","Other","Following these 8 exercises stretching the hips and core. Do not rush this. https://gmb.io/hip-mobility/ 1. Lying Hip Rotations 2. Piriformis Stretch 3. Butterfly 4. Frog 5. Kneeling Lunge 6. Traveling Butterfly 7. Squatting Internal Rotations 8. Pigeon","0.333333333333333","","2019-04-06","","","","","","","0.333333333333333","","","","","","","","","","","","","","","","","","","","","","","","","","","","","","","","3"
"Indoor Cycling","Bike","","","","2019-04-06","","0","196","308","886.544","","1.25385248661041","0","","89","","131","151","","","0.647783052349609","52.17","60","2","0","0","0","","","","","","20","31","3","2","0","0","","","","","",""
"Long low Z2 Easy Aerobic Run","Run","Warmup 15 minutes easy. Run endurance pace in low Aerobic Zone 2. Keep the run easy today. Do not push the pace or intensity. Breathing stays very comfortable! Walk some after the run. Cadence is 90+ steps per minute. Try to include some rolling hills today.","2","","2019-04-07","","23743.330078125","","","","","2.00573754310608","3.28800010681152","","88","","143","155","","","0.889856930930754","178.99","28","53","0","0","0","","","","","","","","","","","","","","","","5","3"
"The MACH 5 MONDAY ""CHECK-IN""","Other","The 5 in ""MACH 5"" refers to the five fundamental areas in life that affect athletic performance including training, health/rest, nutrition, balance, and mental/emotional. Please give me some details about the following 5 areas for today/last week: . 1) Training: how do you feel in general about your recent training and motivation? . 2) Health/Restoration: How many hours of sleep have you been getting the last few nights and how is the quality of your sleep? Are you stretching? Do you have any sniffles/sore throat/cough/abnormal fatigue, etc? Do you have any problem areas, muscularly or otherwise? . 3) Nutrition, how has your nutrition been the last few days? What was your morning weight? . 4) Life/Balance: How has your life-balance of work/school/family/play/stress/etc been this last week? . 5) Mental/Emotional: how ya feeling in general? Anything affecting your training or racing that I should be aware of?","0.0833333333333333","","2019-04-08","","","","","","","","","","","","","","","","","","","","","","","","","","","","","","","","","","","","","","",""
"DAY OFF","Day Off","","","","2019-04-08","","","","","","","","","","","","","","","","","","","","","","","","","","","","","","","","","","","","","","",""
"Hip Stretching Routine","Other","Following these 8 exercises stretching the hips and core. Do not rush this. https://gmb.io/hip-mobility/ 1. Lying Hip Rotations 2. Piriformis Stretch 3. Butterfly 4. Frog 5. Kneeling Lunge 6. Traveling Butterfly 7. Squatting Internal Rotations 8. Pigeon","0.333333","","2019-04-08","","","","","","","","","","","","","","","","","","","","","","","","","","","","","","","","","","","","","","",""
"Swim, Recovery Z1 {2000}","Swim","500 Swim 100 Kick 300 Open Water Swim Drill 300 Pull 8x50 Swim @ 10 seconds rest 4 x 100 descend 1-4 @ 15 seconds rest 200 Easy Keep all this at recovery effort","0.5","1829","2019-04-08","","1920.23901367188","","","","","0.517319170104133","1.03016948667565","","27","","","","","","0.789325329142662","25.44","","","","","","","","","","","","","","","","","","","","","",""
"Z4 LT/FTP Ladder 7-6-5-4","Bike","Warm-up 10 minutes in Zone 2 Ride 2 x 30 seconds one leg spin (right leg) 2 x 30 seconds one leg spin (left leg) 1 minute spinning both legs between each interval Main Set Ride 7-6-5-4 minute intervals in Zone 4 lactate threshold (85-95% FTP). Ride 2 minutes between each interval in Zone 1. Cool-down 10 minutes easy spin","1","","2019-04-09","","0","226","834","817.351","","1.00310254096985","0","","88","","133","165","","","0.797660104397266","63.25","39","12","7","0","0","","","","","","22","9","2","14","6","0","","","","","5","3"
"Hack Squats and Lunges after Bike","Strength","Do 3 sets of 15 reps of hack squats and lunges. Use enough weight in dumbbells to feel a solid burn by the end of each set. Rest 45 seconds between each.","0.333333333333333","","2019-04-09","","","","","","","","","","","","","","","","","","","","","","","","","","","","","","","","","","","","","","",""
"Swim, Aerobic Strength 6 x 200 {2600}","Swim","Warm up 400 easy 8x50 Alternate 50 drill, 50 steady 100 easy Main strength set: 6x200 pull with buoy done as: #1 - steady, 10s rest #2 - mod-hard, 20s rest #3 - hard, 60s rest then repeat 6 x 50 hard on 20s rest 200 free, steady effort","0.833333333333333","2377.43994140625","2019-04-09","","2377.4404296875","","","","","0.596614724265205","1.10645732560004","","26","","","","","","0.847373735736102","36.3","","","","","","","","","","","","","","","","","","","","","",""
"Running","Run","","","","2019-04-09","","5017.759765625","","","","","0.423136949539185","3.29399991035461","","88","","136","162","","","0.901534542294499","37.28","18","1","2","0","0","","","","","","","","","","","","","","","","",""
"Z2/Z3 Aerobic Hilly Run","Run","Warmup easy. Run mostly in zone 2 today but run a hilly route, and allow heartrate to go into zone 3 on the uphills. Don't force heartrate up though. Cool down 5 minutes easy jogging.","0.833333333333333","","2019-04-10","","9929.58984375","","","","","0.834050834178925","3.30699992179871","","89","","138","160","","","0.893870283895803","73.5","25","16","2","0","0","","","","","","","","","","","","","","","","",""
"Hip Opener Yoga","Other","Go through this video at the same speed as the video. https://www.youtube.com/watch?v=IQqbt-oUhV4","0.333333333333333","","2019-04-10","","","","","","","0.333333333333333","","","","","","","","","","","","","","","","","","","","","","","","","","","","","","","","3"
"Swim, Mix it up Steady/Fast {4500}","Swim","Warm up 400 free, 200 backstroke, 100 breastroke - all easy pace, 10s RI 4x25 fly on 15s RI Kick Set, with fins, done twice Through: 200 steady on 10s RI 2x50 fast with board on 10s RI Pull Set, 3 times Through: 400 pull alt by 100 easy / steady - 20s RI 2x50 fast on 10s RI Transition with 200 easy swim with fins Main Set 3 x [4x100] Swim #1 and #2 free mod-hard on 10s RI Swim #3 is free easy pace, DPS on 15s RI Swim #4 - IM or 100 Build, your choice Take 30s RI between sets Cool Down with 200 easy mix of strokes","1.25","4114.7998046875","2019-04-10","","4114.80859375","","","","","1.12465889718797","1.01598732111063","","27","","","","","","0.944732863715688","94.83","","","","","","","","","","","","","","","","","","","","","",""
"Indoor Cycling","Bike","","","","2019-04-10","","0","173","306","623.426","","1.00227439403534","0","","87","","113","129","","","0.560247616957098","31.16","60","0","0","0","0","","","","","","47","3","1","0","0","0","","","","","",""
"Run Z3 Fartlek 90/60/30/15","Run","Warmup 15 minutes easy running. Stop and stretch. Run a fartlek of 2 x 90secs; 4 x 60secs, 4 x 30secs; 4 x 15secs with a recovery of the same time between each rep. Run any remaining time in Z2. Cool down 5 minutes easy running.","1","","2019-04-11","","12301.759765625","","","","","1.00261056423187","3.40799999237061","","89","","139","153","","","0.91391497193863","92.79","21","13","0","0","0","","","","","","","","","","","","","","","","",""
"Swim, Z4 Speed Set {3200}","Swim","Warmup: Swim 500 alternate by 50, free/stroke 200 alternate by 50 kick/swim 100 IM 2x25 fly *All the above on 10s RI Main Set: Two Times The Following: 2x50, sprint 15m, easy 35m -- 15s RI 100, easy 2x50, sprint 20m, easy 30m -- 15s RI 100, easy 2x50, sprint 25m, easy 25m -- 15s RI 100, easy 2x50, max effort 50, first from a dive, second from a push, 30 sec RI 4x100, pullbuoy, first and last easy, middle two steady, 10s RI Cool down: 150 easy cool down sprint = max effort","1","2926.080078125","2019-04-11","","1828.79907226563","","","","","0.483625280327267","1.04989595890065","","27","","","","","","0.976421214098263","45.02","","","","","","","","","","","","","","","","","","","","","",""
"Bike, Z2 Aerobic Intervals 3 X 10","Bike","Warmup up 15 minutes Eesy. Ride 4 X 10 minutes of Aerobic Intervals in the last few beats of your aerobic zone 2. Let heartrate come down for 3 minutes in between these intervals. Cool down 5 minutes easy. Cadence range is 80-105 rpm, with cadence mostly in the 90s.","1","","2019-04-11","","0","211","330","889.45","","1.16915917396545","0","","87","","129","147","","","0.701842081103931","57.29","46","4","0","0","0","","","","","","24","17","26","1","0","0","","","","","",""
"Swim, Z2 Endurance Long Swim {4000}","Swim","Warmup 700 swim easy 6 x 50 pull with buoy 4 x 50 kick Main Set: 1x1000 2 min rest 1x800 1 min rest 8x100 on 15 sec rest with open water sighting drill Cool down 200 easy","1.16666666666667","3657.60009765625","2019-04-12","","3657.6064453125","","","","","1.01626695103116","0.999384797255112","","26","","","","","","0.929328764645215","81.57","","","","","","","","","","","","","","","","","","","","","",""
"~Shake out run","Run","Easy peazy. Stop if anything hurts. Don't worry about heartrate. Just go by feel and loosen the legs up.","0.416666666666667","","2019-04-12","","5011.830078125","","","","","0.417454153299332","3.33500003814697","","86","","154","167","","","0.901438615477657","36.75","1","9","13","0","0","","","","","","","","","","","","","","","","",""
"Strength, core/upper body strength","Strength","Perform core work, including abdominal and back exercises. Also include some arm exercises like pushups, bicep curls, tricep extensions, lat pulldowns, and shoulder raises. Some core examples can be found here: https://www.self.com/gallery/21-incredibly-effective-abs-exercises-you-can-do-instead-of-crunches","0.333333333333333","","2019-04-12","","","","","","","","","","","","","","","","","","","","","","","","","","","","","","","","","","","","","","",""
"Z2 Bike, Aerobic Ride","Bike","Warmup up 10 minutes light spinning. Ride in Aerobic Zone 2. Progress from low to high Zone 2 throughout the workout. Throw in a 15 second pickup every 15 minutes. Cool down 10 minutes easy. Cadence range is 80-105 rpm, with cadence mostly in the 90s. Log average HR in the Post-Activity Comments.","5","","2019-04-13","","0","215","440","796.416","","1.02679193019867","0","","89","","128","148","","","0.701180498253974","50.01","60","1","0","0","0","","","","","","14","34","6","0","1","0","","","","","",""
"Brother in town","Other","Can I do a 3 hour today and 2 hour bike sunday after he leaves?","","","2019-04-13","","101.610000610352","","","","","0.0471475012600422","0.598999977111816","","21","","87","105","","","0.557827946803088","1.49","3","0","0","0","0","","","","","","","","","","","","","","","","",""
"Hiking","Other","","","","2019-04-13","","7033.580078125","","","","","2.33389067649841","0.837000012397766","","10","","105","138","","","0.574154639962465","87.06","140","0","0","0","0","","","","","","","","","","","","","","","","",""
"Long low Z2 Easy Aerobic Run","Run","Warmup 15 minutes easy. Run endurance pace in low Aerobic Zone 2. Keep the run easy today. Do not push the pace or intensity. Breathing stays very comfortable! Walk some after the run. Cadence is 90+ steps per minute. Try to include some rolling hills today.","1.5","","2019-04-14","","17933.349609375","","","","","1.5094428062439","3.29999995231628","","89","","144","167","","","0.896951241671931","135.92","17","38","5","0","0","","","","","","","","","","","","","","","","",""
"Hip Opener Yoga","Other","Go through this video at the same speed as the video. https://www.youtube.com/watch?v=IQqbt-oUhV4","0.333333333333333","","2019-04-14","","","","","","","0.333333333333333","","","","","","","","","","","","","","","","","","","","","","","","","","","","","","","",""
"Indoor Cycling","Bike","","","","2019-04-14","","0","217","455","1579.868","","2.02143692970276","0","","90","","132","164","","","0.739722519682924","109.88","103","6","4","0","0","","","","","","19","54","6","2","6","0","","","","","",""
"Indoor Cycling","Bike","","","","2019-04-14","","0","229","489","825.352","","1.00129306316376","0","","88","","137","170","","","0.836408659700182","69.58","37","5","13","1","0","","","","","","26","8","1","0","18","0","","","","","",""
"The MACH 5 MONDAY ""CHECK-IN""","Other","The 5 in ""MACH 5"" refers to the five fundamental areas in life that affect athletic performance including training, health/rest, nutrition, balance, and mental/emotional. Please give me some details about the following 5 areas for today/last week: . 1) Training: how do you feel in general about your recent training and motivation? . 2) Health/Restoration: How many hours of sleep have you been getting the last few nights and how is the quality of your sleep? Are you stretching? Do you have any sniffles/sore throat/cough/abnormal fatigue, etc? Do you have any problem areas, muscularly or otherwise? . 3) Nutrition, how has your nutrition been the last few days? What was your morning weight? . 4) Life/Balance: How has your life-balance of work/school/family/play/stress/etc been this last week? . 5) Mental/Emotional: how ya feeling in general? Anything affecting your training or racing that I should be aware of?","0.0833333333333333","","2019-04-15","","","","","","","","","","","","","","","","","","","","","","","","","","","","","","","","","","","","","","",""
"Note--I have put the workouts in the order I want them done for the day.","Other","","","","2019-04-15","","","","","","","","","","","","","","","","","","","","","","","","","","","","","","","","","","","","","","",""
"BUILD WEEK... RECOVERY WEEK NEXT WEEK!","Other","","","","2019-04-15","","","","","","","","","","","","","","","","","","","","","","","","","","","","","","","","","","","","","","",""
"Swim, 800 Madness {4200}","Swim","Warmup 400 easy 400 Endurance 2 x 200 Build 400 Endurance 4 x 100 Kick 400 Endurance 8 x 50, Alternating IM order 25/Free 25 400 Endurance 16 x 25 ""Roller Coasters"": 1 Easy 2 fast//2 easy 3 fast, twice through 400 Pull with Buoy and Paddles 200 Easy Free Cooldown Take 10 seconds rest between everything except 5 seconds on the 25s","1.16666666666667","","2019-04-15","","3840.4873046875","","","","","1.09228611575233","0.976249219210935","","26","","","","","","0.907883511515103","81.74","","","","","","","","","","","","","","","","","","","","","",""
"Hip Stretching Routine","Other","Following these 8 exercises stretching the hips and core. Do not rush this. https://gmb.io/hip-mobility/ 1. Lying Hip Rotations 2. Piriformis Stretch 3. Butterfly 4. Frog 5. Kneeling Lunge 6. Traveling Butterfly 7. Squatting Internal Rotations 8. Pigeon","0.333333333333333","","2019-04-15","","","","",""," *04/16/2019 Keith Kruelskie: Need more of this!*","0.333333333333333","","","","","","","","","","","","","","","","","","","","","","","","","","","","","","","","3"
"Z2 Aerobic Run before or after the bike","Run","Warmup and cooldown as needed. Endurance run before or after bike session. All zone 2.","0.333333333333333","","2019-04-15","","4040.90991210938","","","","","0.342988342046738","3.27300000190735","","89","","135","152","","","0.885526166495027","29.01","14","4","0","0","0","","","","","","","","","","","","","","","","5","3"
